{
  "version": 1,
  "preset": "x-timeline",
  "mode": "content",
  "url": "https://x.com/testuser",
  "expect": "success",
  "assertions": {
    "contains": [
      "## @testuser",
      "`pinned`",
      "`quote`",
      "https://x.com/testuser/status/100"
    ],
    "not_contains": [
      "`repost`",
      "`reply`"
    ]
  }
}
