{
  "version": 1,
  "preset": "chatgpt-conversation",
  "mode": "content",
  "url": "",
  "expect": "success",
  "structured": {
    "turns": [
      {
        "role": "user",
        "content": "Can a docker container be frozen and started quickly from a snapshot with processes already running?"
      },
      {
        "role": "assistant",
        "content": "Yes—**on Linux**, you *can* “freeze” a container and later “start” it again with the **processes continuing from where they left off**, using **checkpoint/restore** (typically via **CRIU**). [CRIU+1](https://criu.org/Main_Page?utm_source=chatgpt.com)\n\n### How it works (conceptually)\n\n* **Checkpoint**: dump process state (memory, registers, open FDs, etc.) to files on disk.\n* **Restore**: re-create the processes and resume execution from that state. [CRIU](https://criu.org/Main_Page?utm_source=chatgpt.com)\n\n### Docker: supported, but “experimental”\n\nDocker has a `docker checkpoint` command set described as an **experimental feature** for checkpoint/restore. [Docker Documentation](https://docs.docker.com/reference/cli/docker/checkpoint/?utm_source=chatgpt.com)\nTypical shape:\n\n* `docker checkpoint create <container> <name>`\n* `docker start --checkpoint <name> <container>`\n\n(Exact flags and availability depend on your engine/runtime setup, and CRIU must be available/compatible.)\n\n### Practical reality: it’s not as magical as a VM snapshot\n\nCheckpoint/restore can be **fast-ish**, but it’s not always “instant”:\n\n* Restore time often scales with **memory size** and **state complexity** (writing/reading dumps).\n* Some things are hard or impossible to restore cleanly (see below).\n\nIf your main goal is “resume in a second with everything intact,” a **VM suspend/resume snapshot** often behaves closer to that expectation than container C/R.\n\n### Common limitations / gotchas\n\nCheckpoint/restore is powerful but finicky:\n\n* **Linux-only** in practice (because it relies on Linux kernel features). CRIU is a Linux project. [CRIU](https://criu.org/Main_Page?utm_source=chatgpt.com)\n  On **macOS/Windows Docker Desktop**, containers run inside a Linux VM, and C/R support may be limited by that environment.\n* **Kernel / environment sensitivity**: restore usually expects a very similar kernel + userspace + container config.\n* **External resources** can break restore: network connections, special devices, FUSE mounts, some IPC patterns, GPUs, etc. (CRIU is improving here, but this is the typical pain point).\n* **Rootless vs root**: tooling support varies (e.g., Podman’s CRIU integration notes root-only support in some setups). [CRIU](https://criu.org/Podman?utm_source=chatgpt.com)\n\n### If you’re actually trying to do this “for real”\n\nTwo mainstream routes:\n\n* **Docker checkpoint/restore (experimental)** using CRIU underneath. [Docker Documentation](https://docs.docker.com/reference/cli/docker/checkpoint/?utm_source=chatgpt.com)\n* **Podman checkpoint/restore** (often considered the smoother path for C/R in practice, depending on distro/runtime). [CRIU](https://criu.org/Podman?utm_source=chatgpt.com)\n\nAnd if you’re in Kubernetes land: **container checkpointing** exists and has been progressing (alpha → beta per CRIU’s K8s overview), and there’s even a dedicated working group as of Jan 2026. [CRIU+1](https://criu.org/Kubernetes?utm_source=chatgpt.com)\n\nIf you tell me your platform (native Linux vs Docker Desktop on macOS/Windows) and whether you need **“fast restart”** vs **“live migration / stateful resume”**, I can point you to the least-painful approach for that specific goal."
      },
      {
        "role": "user",
        "content": "Can I do it with apple/container?"
      },
      {
        "role": "assistant",
        "content": "Probably **not in the way you mean (process checkpoint/restore)**.\n\nApple’s **`container`** runs each container inside a **lightweight Linux VM** on macOS. [Apple Open Source](https://opensource.apple.com/projects/container?utm_source=chatgpt.com) That project definitely uses the word **“snapshots”**, but from the public issues/logging it’s referring to **storage/image/rootfs snapshotting** (e.g., `rootfs.ext4` copies and large sparse snapshot files under `~/Library/Application Support/com.apple.container/snapshots`)—not “resume with processes already running.” [GitHub+1](https://github.com/apple/container/issues/784?utm_source=chatgpt.com)\n\nAlso, the documented CLI surface (command categories and examples) doesn’t expose anything like **checkpoint/restore** or **suspend/resume** for live processes. [Trunktail](https://trunktail.pages.dev/commands/?utm_source=chatgpt.com)\n\n### What you *can* do instead (pragmatic options)\n\n* **If you want fast startup:** keep images warm/unpacked and avoid heavy init (the “snapshot” machinery here helps with image/rootfs management, not process state). [GitHub+1](https://github.com/apple/container/issues/589?utm_source=chatgpt.com)\n* **If you truly need “resume with processes”:** use **CRIU-based checkpoint/restore** on native Linux runtimes that support it (Docker/Podman on Linux). CRIU is the standard mechanism for that feature. [CRIU](https://criu.org/Main_Page?utm_source=chatgpt.com)\n* **On macOS specifically:** the closest analog is usually **VM suspend/resume** (snapshot the VM), but Apple/container does not appear to expose that as a supported workflow via its CLI/docs today. [Trunktail+1](https://trunktail.pages.dev/commands/?utm_source=chatgpt.com)\n\nIf you tell me whether your goal is **(A) “restart quickly”** or **(B) “resume exact process state”**, I’ll suggest the simplest setup that actually works on macOS."
      }
    ]
  },
  "assertions": {
    "contains": [
      "## User",
      "## Assistant"
    ]
  }
}
