{
  "version": 1,
  "preset": "docs-section-nav",
  "mode": "nav-links",
  "url": "https://docs.example.test/guide",
  "expect": "failure",
  "category_pages": [
    {
      "section_url": "https://docs.example.test/guide/getting-started",
      "page": "category-empty.html"
    }
  ],
  "failure": {
    "type": "ValueError",
    "contains": "found no links"
  }
}
