{
  "version": 1,
  "preset": "x-article",
  "mode": "content",
  "expect": "success",
  "structured": {
    "author_handle": "write",
    "links": [
      "https://x.com/i/premium_sign_up",
      "https://x.com/i/verified-orgs-signup",
      "https://help.x.com/en/using-x/articles"
    ],
    "markdown": "Today, we are excited to announce Articles, a new way to write and share long-form content with your followers on X.\n\nComposing an Article\n\nBring up the Article composer by selecting Articles in the sidebar on web. From there, you can begin crafting your content using a variety of formatting options, including bold, italic, and strikethrough text, as well as bullet points and numbered lists.\n\nYou can also embed images and videos to enhance your storytelling and add visual interest to your Articles.\n\nReleasing your Article to the world\n\nOnce published, Articles will appear on your profile in a new Articles tab and in your followers' timeline, just like regular X posts.\n\nArticles will also be easily distinguishable thanks to a unique icon and layout, ensuring that your long-form content stands out.\n\nAccess to Articles\n\nArticles is available to \n\n[Premium+](https://x.com/i/premium_sign_up)\n\n subscribers and \n\n[Verified Organizations](https://x.com/i/verified-orgs-signup)\n\n. Learn more about how to use Articles → \n\n[About Articles](https://help.x.com/en/using-x/articles)",
    "published_at": "2024-03-07T23:36:18Z",
    "title": "Introducing Articles on X",
    "url": "https://x.com/Write/article/1765884209527394325",
    "warnings": []
  },
  "url": "https://x.com/Write/article/1765884209527394325"
}
